{"contract_version":"1.0","message_type":"response","request_id":"session-open-1","status":"completed","payload":{"active_session_id":null,"context_id":"context-anonymous","data_root":"C:\\anonymous-project\\AI_Area_Assistant_Data","requires_user_choice":true,"sessions":[{"session_id":"11111111-1111-4111-8111-111111111111","status":"idle","updated_at":"2026-08-13T00:00:00+00:00"}]}}
